{
  "$schema": "https://json-schema.org/draft/2020-12/schema",
  "$id": "https://raw.githubusercontent.com/openwallet-foundation/eudiplo/refs/heads/main/schemas/UpdateIssuanceDto.schema.json",
  "title": "UpdateIssuanceDto",
  "type": "object",
  "properties": {
    "walletProviderTrustLists": {
      "description": "Trust lists containing trusted wallet providers.\nEach entry MUST include either `verifierKey` or `verifierX509Der`.",
      "type": "array",
      "items": {
        "$ref": "./WalletProviderTrustListRefDto.schema.json"
      }
    },
    "signingKeyId": {
      "type": "string",
      "description": "Key ID for signing access tokens. If unset, the default signing key is used."
    },
    "authorizationServers": {
      "type": "array",
      "description": "Dedicated managed authorization servers hosted by this issuer. At least one entry is required.",
      "minItems": 1,
      "items": {
        "oneOf": [
          {
            "$ref": "./ExternalAuthorizationServerConfig.schema.json"
          },
          {
            "$ref": "./Oid4VpAuthorizationServerConfig.schema.json"
          },
          {
            "$ref": "./ChainedAuthorizationServerConfig.schema.json"
          },
          {
            "$ref": "./BuiltInAuthorizationServerConfig.schema.json"
          }
        ],
        "discriminator": {
          "propertyName": "type",
          "mapping": {
            "external": "#/components/schemas/ExternalAuthorizationServerConfig",
            "oid4vp": "#/components/schemas/Oid4VpAuthorizationServerConfig",
            "chained": "#/components/schemas/ChainedAuthorizationServerConfig",
            "built-in": "#/components/schemas/BuiltInAuthorizationServerConfig"
          }
        }
      }
    },
    "federation": {
      "nullable": true,
      "description": "Optional OpenID Federation configuration used for trust evaluation.\nWhen omitted, trust checks rely on existing LoTE trust-list behavior.",
      "type": "object",
      "allOf": [
        {
          "$ref": "./FederationConfig.schema.json"
        }
      ]
    },
    "registrationCertificate": {
      "nullable": true,
      "description": "Optional registration certificate configuration for issuer metadata (`issuer_info`).\nSupports importing an existing JWT or generating one via registrar.",
      "type": "object",
      "allOf": [
        {
          "$ref": "./IssuerRegistrationCertificateConfig.schema.json"
        }
      ]
    },
    "registrationCertificateCache": {
      "nullable": true,
      "description": "Server-managed cache for generated issuer registration certificates.",
      "readOnly": true,
      "type": "object",
      "allOf": [
        {
          "$ref": "./IssuerRegistrationCertificateCache.schema.json"
        }
      ]
    },
    "credentialResponseEncryption": {
      "type": "boolean",
      "description": "Whether `credential_response_encryption` should be advertised in the credential issuer metadata.",
      "default": false
    },
    "credentialRequestEncryption": {
      "type": "boolean",
      "description": "Whether `credential_request_encryption` should be advertised in the credential issuer metadata.",
      "default": false
    },
    "txCodeMaxAttempts": {
      "type": "number",
      "description": "Maximum failed tx_code attempts before the pre-authorized code is invalidated. Defaults to 5.",
      "default": 5,
      "nullable": true
    },
    "batchSize": {
      "type": "number",
      "description": "Value to determine the amount of credentials that are issued in a batch.\nDefault is 1."
    },
    "dPopRequired": {
      "type": "boolean",
      "description": "Indicates whether DPoP is required for the issuance process. Default value is true."
    },
    "walletAttestationRequired": {
      "type": "boolean",
      "description": "Indicates whether wallet attestation is required for the token endpoint.\nWhen enabled, wallets must provide OAuth-Client-Attestation headers.\nDefault value is false."
    },
    "display": {
      "type": "array",
      "items": {
        "$ref": "./DisplayInfo.schema.json"
      }
    }
  },
  "additionalProperties": false
}