{
    "authorizationServers": [
        {
            "id": "issuer-built-in",
            "type": "built-in",
            "label": "default built-in AS"
        }
    ],
    "batchSize": 10,
    "dPopRequired": false,
    "display": [
        {
            "locale": "en-US",
            "name": "EUDI Wallet dev",
            "logo": {
                "uri": "company.png"
            }
        }
    ]
}